{
  "$schema": "https://json-schema.org/draft/2020-12/schema",
  "$id": "https://hermes.local/anti-slop/findings.schema.json",
  "title": "Anti-Slop Findings",
  "description": "Validated diagnostic findings. P0 validates supplied findings and evidence; it does not generate findings or mutate repositories.",
  "type": "array",
  "items": {
    "type": "object",
    "additionalProperties": false,
    "required": [
      "id",
      "title",
      "source",
      "evidence_refs",
      "severity",
      "impact",
      "confidence",
      "recommended_action",
      "counterargument"
    ],
    "properties": {
      "id": {"type": "string", "minLength": 1},
      "title": {"type": "string", "minLength": 1},
      "source": {"type": "string", "minLength": 1},
      "evidence_refs": {
        "type": "array",
        "minItems": 1,
        "items": {"type": "string", "minLength": 1}
      },
      "severity": {"enum": ["info", "low", "medium", "high", "critical"]},
      "impact": {"type": "string", "minLength": 1},
      "confidence": {"type": "number", "minimum": 0, "maximum": 1},
      "recommended_action": {"type": "string", "minLength": 1},
      "counterargument": {"type": "string", "minLength": 1},
      "path": {"type": ["string", "null"]},
      "line": {"type": ["integer", "null"], "minimum": 1},
      "column": {"type": ["integer", "null"], "minimum": 1}
    }
  }
}
